Product,Design Features,Colors,Textures,Scale,Style
LEGO Roses Building Kit,Intricate rose design made from LEGO pieces,Red and green,Smooth plastic,"Small, detailed model","Creative, educational toy"
Stanley Quencher Insulated Tumbler,"Insulated, ergonomic handle",Multiple color options including pastel and metallic finishes,"Smooth exterior, insulated interior",Medium-sized tumbler,"Functional, stylish"
Pampers Swaddlers Diapers,"Soft, absorbent material with flexible sides",White with subtle colored patterns,"Soft, cotton-like",Various sizes for infants,"Practical, comfortable"
Purina Fancy Feast Gravy Wet Cat Food,Easy-open cans,Colorful labels with images of cats,"Wet, gravy consistency",Small cans,"Convenient, appealing to pet owners"
Amazon Basics Easy Grip Workout Dumbbell,"Ergonomic grip, hexagonal shape to prevent rolling",Various bright and dark colors,Rubber coating,Multiple weight options,"Functional, durable"
Bounty Quick Size Paper Towels,Perforated sheets for easy tearing,White with subtle designs,"Soft, absorbent",Multiple roll sizes,"Practical, essential household item"
Refrigerator Water Filter,"Compact, easy to install",Typically white or gray,Smooth plastic,Standardized to fit various refrigerators,"Functional, essential"
Amazon Fire HD 8 Tablet,"Touchscreen, lightweight","Black, blue, and other vibrant colors","Smooth screen, matte back",Medium-sized tablet,"Sleek, modern"
Hanes Men’s Ecosmart Fleece Sweatshirt,Pullover with ribbed cuffs and waistband,Multiple solid colors,Soft fleece,Various sizes,"Casual, eco-friendly"
Gerber Unisex Baby Onesies,"Snap closures, expandable shoulders",Pastel colors and patterns,Soft cotton,Infant sizes,"Comfortable, practical"
CRILARY’s Water Balloons,"Reusable, easy-fill design","Bright, assorted colors","Soft, flexible",Standard balloon size,"Fun, playful"
Aqua LEISURE’s Pool Hammock,"Inflatable, mesh seat",Various bright colors,"Smooth, durable plastic",Fits one person,"Relaxing, leisure"
Pamper’s Swim Diapers,"Leak-proof, stretchy sides",Fun patterns,"Soft, water-resistant",Various baby sizes,"Practical, comfortable"
AMACOOL’s Stroller Fan,"Flexible tripod, USB rechargeable",Various colors,Smooth plastic,"Small, portable","Functional, convenient"
Banana Boat’s Sunscreen,"Easy-squeeze bottle, SPF protection",Bright yellow and blue,Smooth lotion,Various bottle sizes,"Protective, essential"
Victoria’s Secret’s Body Spray,Elegant spray bottle,"Pink, purple",Smooth liquid,Small to medium bottles,"Luxurious, fragrant"
CUSHIONAIRE’s Sandals,"Slip-on, cushioned footbed",Neutral and bright colors,"Soft, flexible",Various sizes,"Comfortable, stylish"
CHICGAL’s Women’s Blouse,"Loose fit, various patterns",Multiple vibrant colors,"Light, breathable fabric",Various sizes,"Fashionable, casual"
Alpha Griller’s Meat Thermometer,"Digital readout, foldable probe","Black, red",Smooth plastic,Compact,"Practical, essential for grilling"
TCL 32-Inch Smart TV,"High-definition display, smart capabilities",Black,"Smooth screen, textured back",32 inches,"Modern, functional"
Echo Dot (5th Gen),"Compact, spherical design","Black, white, and other colors",Matte finish,Small,"Smart, tech-savvy"
Instant Pot Duo 7-in-1 Electric Pressure Cooker,"Multifunctional, stainless steel","Silver, black",Smooth metal,Medium-sized appliance,"Practical, versatile"
Apple AirPods Pro,"Wireless, noise-canceling",White,Smooth plastic,Small,"Modern, high-tech"
Hydro Flask Water Bottle,"Insulated, durable",Various bright and neutral colors,Matte finish,Various sizes,"Practical, stylish"
Furbo Dog Camera,"Treat dispenser, two-way audio",White,Smooth plastic,Medium-sized device,"Functional, pet-friendly"
